<?xml version="1.0" encoding="UTF-8"?>
<!DOCTYPE table SYSTEM "rapid-ibatis-table-config.dtd">

<!-- 
<!DOCTYPE table PUBLIC "-//www.rapid-framework.org.cn//DTD Table Config 2.0//CN" 
    "rapid-ibatis-table-config.dtd">
 -->
<table dummypk="" namespace="" remarks="" sequence="" sqlname="">

	<column name="service_fee" javatype="com.iwallet.biz.common.util.money.Money" />
	<column name="SERVICE_FEE" javatype="com.iwallet.biz.common.util.money.Money" />
	
	<column name="TOTAL_FEE" javatype="com.iwallet.biz.common.util.money.Money" />
	<column name="SERVICE_FEE_RATIO" javatype="double" />
	<column javatype="" name=""/>
	<column name="amount" javatype="com.iwallet.biz.common.util.money.Money" />
	<column name="AMOUNT" javatype="com.iwallet.biz.common.util.money.Money" />
	
	<column name="bank_amount" javatype="com.iwallet.biz.common.util.money.Money" />
	<column name="BANK_AMOUNT" javatype="com.iwallet.biz.common.util.money.Money" />
	
	<column name="return_fee" javatype="com.iwallet.biz.common.util.money.Money" />
	<column name="RETURN_FEE" javatype="com.iwallet.biz.common.util.money.Money" />
	
	<column javatype="" name=""/>
	
	<resultmap name="">
		<column javatype="" name=""/>
	</resultmap>
	
	<operation name="" multiplicity="one" paramtype="" remarks="">
		<sql>
		</sql>
		<sqlmap>
		
		</sqlmap>
	</operation>
	
	<sql id="findAccountLog.where">
		<isNotEmpty >
		
		</isNotEmpty>
		<isGreaterEqual>
			
		</isGreaterEqual>
		<iterate open="" close=""></iterate>
	  	<isEmpty property="accountNo">
			<isEmpty property="transDtBegin">
		  		<isEmpty property="transDtEnd">
		        	query not allowed
		  		</isEmpty>
			</isEmpty>
  	  	</isEmpty>
				
    	<isEqual prepend="and" property="isIncomeOrOutcome" compareValue="INCOME">
			MAL.TRANS_AMOUNT > 0
		</isEqual> 
		
    	<isEqual prepend="and" property="isIncomeOrOutcome" compareValue="OUTCOME">
			MAL.TRANS_AMOUNT &lt; 0
		</isEqual>
				
    	<isNotEmpty prepend="and" property="iwAccountLogId">
			MAL.IW_ACCOUNT_LOG_ID = #iwAccountLogId#
		</isNotEmpty> 
	</sql>
	
	<operation name="findAccountLogWithAirExt" paging="true" paramtype="primitive" remarks="帐务明细查询">
		<extraparams>
			<param name="isIncomeOrOutcome" javatype="java.lang.String"/>
			<param name="payType" javatype="java.lang.String"/>	
			<param name="minTransAmount" javatype="Long"/>	
			<param name="maxTransAmount" javatype="Long"/>	
		</extraparams>	
		<sql>
			<include refid=""/>
			<iterate></iterate>
		</sql>
		<sqlmap>
		</sqlmap>
	</operation>
	
</table>